{"schema_version":1,"kind":"impact_context","scope":{"fingerprint":"aaaaaaaaaaaaaaaaaaaaaaaaaaaaaaaaaaaaaaaa","source":"staged","candidate_digest":"bbbbbbbbbbbbbbbbbbbbbbbbbbbbbbbbbbbbbbbbbbbbbbbbbbbbbbbbbbbbbbbb"},"mode":"fast","status":"partial","providers":[{"provider_id":"1111111111111111","provider_kind":"tree-sitter-rust","provider_version":"0.24.2","configuration_digest":"cccccccccccccccccccccccccccccccccccccccccccccccccccccccccccccccc","status":"partial","elapsed_ms":0,"input_files":1,"input_bytes":1,"output_fact_count":0,"cache_hits":0,"cache_misses":0,"cache_stale":0,"cache_corrupt":0,"limitation_ids":["2222222222222222"]}],"units":[{"manifest_unit_id":"file:src/lib.rs","path":"src/lib.rs","language":"rust","content_sha256":"dddddddddddddddddddddddddddddddddddddddddddddddddddddddddddddddd","content_bytes":1,"presence":"present","syntax_eligible":true,"syntax_status":"partial","text_status":"completed","parse_quality":"degraded","provider_ids":["1111111111111111"],"changed_ranges":[{"start_line":1,"start_column":1,"end_line":1,"end_column":2,"start_byte":0,"end_byte":1}],"error_node_count":1,"missing_node_count":0,"parse_affected_ranges":[{"start_line":1,"start_column":1,"end_line":1,"end_column":2,"start_byte":0,"end_byte":1}],"parse_affected_symbol_ids":[],"changed_symbol_ids":[],"limitation_ids":["2222222222222222"]}],"changed_symbols":[],"impact_edges":[],"domain_summaries":[],"coverage":{"total_candidate_files":1,"changed_candidate_files":1,"syntax_eligible_files":1,"parsed_files":1,"clean_parse_files":0,"recovered_parse_files":0,"degraded_parse_files":1,"unsupported_files":0,"resource_limited_files":0,"unavailable_files":0,"cache_hits":0,"cache_misses":0,"cache_stale":0,"cache_corrupt":0,"requested_graph_depth":0,"reached_graph_depth":0,"graph_index_completeness":"unavailable","graph_query_completeness":"unavailable","output_truncated":false},"limitations":[{"limitation_id":"2222222222222222","code":"syntax-recovery-overlaps-changed-structure","provider_id":"1111111111111111","path":"src/lib.rs","symbol_id":null,"reason":"Parser recovery overlaps changed structure","interpretation":"Changed structure has reduced confidence","improvable_in_deep_mode":true}],"metrics":{"elapsed_ms":0,"candidate_input_files":1,"candidate_input_bytes":1,"nodes_visited":1,"max_nesting_depth":1,"facts_emitted":0,"edges_emitted":0,"summaries_emitted":0,"output_bytes":0}}
