{"schema_version":1,"kind":"impact_context","scope":{"fingerprint":"aaaaaaaaaaaaaaaaaaaaaaaaaaaaaaaaaaaaaaaa","source":"staged","candidate_digest":"bbbbbbbbbbbbbbbbbbbbbbbbbbbbbbbbbbbbbbbbbbbbbbbbbbbbbbbbbbbbbbbb"},"mode":"fast","status":"invalidated","providers":[],"units":[],"changed_symbols":[],"impact_edges":[],"domain_summaries":[],"coverage":{"total_candidate_files":0,"changed_candidate_files":0,"syntax_eligible_files":0,"parsed_files":0,"clean_parse_files":0,"recovered_parse_files":0,"degraded_parse_files":0,"unsupported_files":0,"resource_limited_files":0,"unavailable_files":0,"cache_hits":0,"cache_misses":0,"cache_stale":0,"cache_corrupt":0,"requested_graph_depth":0,"reached_graph_depth":0,"graph_index_completeness":"unavailable","graph_query_completeness":"unavailable","output_truncated":false},"limitations":[],"metrics":{"elapsed_ms":0,"candidate_input_files":0,"candidate_input_bytes":0,"nodes_visited":0,"max_nesting_depth":0,"facts_emitted":0,"edges_emitted":0,"summaries_emitted":0,"output_bytes":0}}
